{
  "id": "evt-2026-10-01-sra-pause-colp-cofa",
  "date": "2026-10-01",
  "type": "regulation",
  "sota_score": 6.6,
  "ai_legaltech": false,
  "title": "SRA pausa las nuevas reglas COLP/COFA tras presion de firmas SME (UK)",
  "summary_p1": "La Solicitors Regulation Authority britanica anuncio el 1 de octubre de 2026 una \"pausa\" en la implantacion de las nuevas reglas sobre compliance officers. Las normas ya aprobadas por el Legal Services Board impedian que un manager con poder de decision unilateral fuera COLP o COFA en firmas con facturacion superior a 600.000 GBP o mas de 2 millones GBP en client money. La reaccion de firmas pequenas y de la SME & Boutique Law Firm Alliance (incluido un posible voto de no confianza en la AGM de la Law Society) ha obligado a la SRA a \"tomar stock\" y consultar opciones proporcionales. Es improbable que el rollout de enero 2027 se mantenga si hacen falta nuevos vistos del LSB.",
  "summary_p2": "Pieza no-AI a proposito: el radar no solo mira modelos. Para LegalTech UK y para firmas con presencia Londinense, la gobernanza COLP/COFA condiciona quien puede firmar compliance y que software de risk/AML se exige. Un cambio (o su pausa) mueve presupuestos de compliance tech y de outsourcing de COFA. En ES, el paralelo es quien ostenta la funcion de compliance/RGPD cuando la firma escala: no asumas que el socio unico puede ser a la vez decision unilateral y organo de control. Seguimiento: texto final tras la consulta de las proximas semanas.",
  "why_sota": "Pausa regulatoria material sobre governance de firmas UK; impacto en compliance ops.",
  "why_now": "Anuncio SRA 1 Oct 2026 (Legal Futures). NEW; balance no-AI del dia.",
  "geo": [
    "UK"
  ],
  "topics": [
    "sra",
    "colp",
    "cofa",
    "compliance",
    "sme",
    "governance"
  ],
  "sources": [
    {
      "source_id": "src-legal-futures",
      "url": "https://www.legalfutures.co.uk/latest-news/sra-announces-pause-to-compliance-officer-rule-changes",
      "cited_title": "SRA announces pause to compliance officer rule changes",
      "accessed": "2026-10-01"
    }
  ],
  "entities": [
    "ent-sra"
  ],
  "lang": "es",
  "status": "published"
}
