{
  "id": "evt-2026-10-02-ai-value-gap",
  "date": "2026-09-30",
  "type": "research",
  "sota_score": 6.5,
  "ai_legaltech": true,
  "title": "AI Value Gap: el 91% ve a su organización por debajo del potencial de la IA (y solo el 18% mide ROI)",
  "summary_p1": "El 30 de septiembre de 2026 Artificial Lawyer publicó el análisis de AI Futures Forum \"The AI Value Gap\", anclado en el Future of Professionals 2026 de Thomson Reuters: el 91% de fee earners cree que su organización se queda corta respecto a lo que la IA podría entregar. Solo el 18% recoge métricas de ROI de forma sistemática; las firmas con estrategia de IA visible tienen casi cuatro veces más probabilidad de retorno medible. El diagnóstico no es solo inmadurez del tool: es brecha de confianza y ownership en el partnership — incluso entre heavy users, solo alrededor de un tercio ha hablado del impacto con la mayoría de sus clientes.",
  "summary_p2": "Añade tensión estructural: quien se apropia del valor cuando se entrena sobre el juicio acumulado de socios (spin-offs, plataformas propietarias tipo el compromiso multimillonario de algunas firmas) y la amenaza de labs (Claude for Legal, Astra for Law) que suben a la capa de aplicación. Para managing partners ES/EU: nombrar accountable de adopción, medir outcomes antes de comprar más seats, y tener la conversación de ownership con la partnership. Útil junto a Iberdrola/Harvey de ayer: sin KPI y gobierno, la licencia no cierra el value gap.",
  "why_sota": "Sintesis accionable del gap adopción-vs-valor con datos TR 2026 y ángulo de ownership/NewMod.",
  "why_now": "AL 30 Sep; NEW vs PASS previos; contraste editorial con oleada de launches.",
  "geo": [
    "UK",
    "US",
    "Global"
  ],
  "topics": [
    "roi",
    "adoption",
    "strategy",
    "thomson-reuters",
    "ai-futures-forum"
  ],
  "sources": [
    {
      "source_id": "src-artificial-lawyer",
      "url": "https://www.artificiallawyer.com/2026/09/30/the-ai-value-gap-why-your-investment-isnt-paying-off/",
      "cited_title": "The AI Value Gap: Why Your Investment Isn't Paying Off",
      "accessed": "2026-10-02"
    },
    {
      "source_id": "src-thomson-reuters-future-of-professionals",
      "url": "https://europe.thomsonreuters.com/guides/future-of-professionals",
      "cited_title": "Thomson Reuters - Future of Professionals (contexto)",
      "accessed": "2026-10-02"
    }
  ],
  "entities": [],
  "lang": "es",
  "status": "published"
}
